,number,author,life,title,width,height,image_url,wall,position,image_path
474,S X ,Fragonard jean honoré, (1732-1806). ,le songe d'amour du guerrier  ,50.5,61.5,https://upload.wikimedia.org/wikipedia/commons/thumb/e/e8/Fragonard%2C_il_sogno_d%27amore_del_guerriero%2C_ante_1791.JPG/1200px-Fragonard%2C_il_sogno_d%27amore_del_guerriero%2C_ante_1791.JPG,,Coll Schlichting,data/images_paintings/474.jpg
475,S X ,Fragonard jean honoré, (1732-1806). ,le nid d'oiseaux,19.0,27.5,https://s3.eu-west-3.amazonaws.com/pop-phototeque/joconde/000PE001197/08-540224.jpg,,Coll Schlichting,data/images_paintings/475.jpg
476,304 ,Fréminet martin, (1567-1614). ,mercure ordonne à enée d'abandonner didon attribué,,,,,XI,
477,305 ,Fromentin eugène, (1820-1870). ,chasse au faucon en algérie la curée,118.0,162.5,https://upload.wikimedia.org/wikipedia/commons/thumb/d/d0/Eug%C3%A8ne_fromentin%2C_caccia_al_falcone_in_algeria%2C_la_corsa%2C_1863.JPG/1200px-Eug%C3%A8ne_fromentin%2C_caccia_al_falcone_in_algeria%2C_la_corsa%2C_1863.JPG,,E F XIXe S 2e étage II,data/images_paintings/477.jpg
478,306 ,Fromentin eugène, (1820-1870). ,le campement arabe,144.0,104.0,https://s3.eu-west-3.amazonaws.com/pop-phototeque/joconde/000PE001214/97-005051a.jpg,,E F XIXe S 1er étage II,data/images_paintings/478.jpg
479,307 ,Fromentin eugène, (1820-1870). ,femmes égyptiennes au bord du nil,105.0,120.0,https://upload.wikimedia.org/wikipedia/commons/thumb/c/cf/Eug%C3%A8ne_Fromentin_-_Souvenir_d%27Ezneh%2C_Haute-%C3%89gypte_-_Orsay_RF_515.jpg/1200px-Eug%C3%A8ne_Fromentin_-_Souvenir_d%27Ezneh%2C_Haute-%C3%89gypte_-_Orsay_RF_515.jpg,,E F XIXe S 2e étage II,data/images_paintings/479.jpg
480,2876 ,Fromentin eugène, (1820-1870). ,chasse au fducon,,,,,T T,
481,2877 ,Fromentin eugène, (1820-1870). ,halte de cavaliers,94.5,73.5,https://s3.eu-west-3.amazonaws.com/pop-phototeque/joconde/000PE001216/92de1599.jpg,,T T,data/images_paintings/481.jpg
482,62,Fromentin eugène, (1820-1870). ,halte de cavaliers arabes,94.5,73.5,https://s3.eu-west-3.amazonaws.com/pop-phototeque/joconde/000PE001216/92de1599.jpg,,Musée Charles X S III,data/images_paintings/482.jpg
483,63,Fromentin eugène, (1820-1870). ,la fantasia,,,,,Coll Chauchard galerie,
484, ,Garnier etienne barthélemy, (17=10-1849). ,hercule obtenant de diane la biche aux cornes d'or peinture dans un des tympans de la voûte,,,,,S Grecque,
485, ,Gassies jean bruno, (178Ó-IS12). ,aliégories de la paix de la justice de la force et de la loi génies symbolisant les sciences les arts l'agriculture le commerce voussures du plafond,,,,,S Meubles XVIIe,
486,310 ,Gellée claude, (1000-1082). ,vue d'un port effet de soleil levant,,,,S,XIV,
487,311 ,Gellée claude, (1000-1082). ,vue du campo vaccino à rome,,,,S,XIV,
488,312 ,Gellée claude, (1000-1082). ,la fète villageoise,135.0,103.0,https://upload.wikimedia.org/wikipedia/commons/thumb/6/6c/Claude_Lorrain_012.jpg/1200px-Claude_Lorrain_012.jpg,N,XIV,data/images_paintings/488.jpg
489,313 ,Gellée claude, (1000-1082). ,un port du mer au soleil couchant,,,,N,XIV,
490,314 ,Gellée claude, (1000-1082). ,le débarquement de cléopâtre à tarse,168.0,119.0,https://upload.wikimedia.org/wikipedia/commons/thumb/6/6f/The_Disembarkation_of_Cleopatra_at_Tarsus_1642_Claude_Lorrain.jpg/1200px-The_Disembarkation_of_Cleopatra_at_Tarsus_1642_Claude_Lorrain.jpg,N,XIV,data/images_paintings/490.jpg
491,315 ,Gellée claude, (1000-1082). ,david sacré roi par samuel,150.0,119.0,https://upload.wikimedia.org/wikipedia/commons/thumb/e/ef/David_sacr%C3%A9_roi_par_le_proph%C3%A8te_Samuel_-_Claude_Le_Lorrain_-_Mus%C3%A9e_du_Louvre_INV_4717.jpg/1200px-David_sacr%C3%A9_roi_par_le_proph%C3%A8te_Samuel_-_Claude_Le_Lorrain_-_Mus%C3%A9e_du_Louvre_INV_4717.jpg,S,XIV,data/images_paintings/491.jpg
492,316 ,Gellée claude, (1000-1082). ,ulysse remet chryséis à son père,150.0,119.0,https://upload.wikimedia.org/wikipedia/commons/thumb/c/cf/Ulysse_remet_Chrys%C3%A9is_%C3%A0_son_p%C3%A8re_by_Gel%C3%A9e_Louvre_INV4718_n01.jpg/1200px-Ulysse_remet_Chrys%C3%A9is_%C3%A0_son_p%C3%A8re_by_Gel%C3%A9e_Louvre_INV4718_n01.jpg,N,XIV,data/images_paintings/492.jpg
493,317 ,Gellée claude, (1000-1082). ,vue d'un port de mer effet de soleil voilé par une bru me,,,,S,XIV,
494,318 ,Gellée claude, (1000-1082). ,un port de mer,137.0,103.0,https://upload.wikimedia.org/wikipedia/commons/thumb/b/bf/F0087_Louvre_Gellee_port_au_soleil_couchant-_INV4715_rwk.jpg/1200px-F0087_Louvre_Gellee_port_au_soleil_couchant-_INV4715_rwk.jpg,S,XIV,data/images_paintings/494.jpg
495,319 ,Gellée claude, (1000-1082). ,marine,150.0,119.0,https://upload.wikimedia.org/wikipedia/commons/thumb/c/cf/Ulysse_remet_Chrys%C3%A9is_%C3%A0_son_p%C3%A8re_by_Gel%C3%A9e_Louvre_INV4718_n01.jpg/1200px-Ulysse_remet_Chrys%C3%A9is_%C3%A0_son_p%C3%A8re_by_Gel%C3%A9e_Louvre_INV4718_n01.jpg,N,XIV,data/images_paintings/495.jpg
496,322 ,Gellée claude, (1600-1682;. ,le gué,150.0,118.0,https://upload.wikimedia.org/wikipedia/commons/e/ec/Claude_Lorrain_-_Landscape_with_Paris_and_Oenone_-_WGA05003.jpg,N,XIV,data/images_paintings/496.jpg
497,323 ,Gellée claude, (1600-1682;. ,entrée d'un port vue de la mer,,,,S,XIV,
498,324 ,Gellée claude, (1600-1682;. ,siège de la rochelle prise par louis xiii le 8 octobre ô28,,,,S,XIV,
499,325 ,Gellée claude, (1600-1682;. ,le pas de suze forcé par louis xiii en 1029,,,,S,XIV,
500,326 ,Gellée claude, (1600-1682;. ,paysage attribué,,,,E,I,
501,328 ,Gérard françois pascal simon, (1770-18; 7). ,psyché reçoit le premier baiser de l'amour,,,,S,II,
502,329 ,Gérard françois pascal simon, (1770-18; 7). ,daphnis et chloé,,,,N,III,
503,332 ,Gérard françois pascal simon, (1770-18; 7). ,portrait de m isabey peintre en miniature et de sa fille depuis mme ciceri,,,,E,III,
504,333 ,Gérard françois pascal simon, (1770-18; 7). ,portrait du sculpteur antonio canova,,,,O,I,
505,336 ,Gérard françois pascal simon, (1770-1837). ,portrait de la comtesse regnaud de saintjean d'angély,,,,O,III,
506,337 ,Gérard françois pascal simon, (1770-1837). ,portrait de la marquise visconti,,,,S,III,
507,S N ,Gérard françois pascal simon, (1770-1837). ,portrait de madame barbier walbonne,,,,O,I,
508,338 ,Géricault jean louis andré théodore, (17° J - J 824). ,le radeau de la méduse,716.0,491.0,https://upload.wikimedia.org/wikipedia/commons/thumb/1/15/JEAN_LOUIS_TH%C3%89ODORE_G%C3%89RICAULT_-_La_Balsa_de_la_Medusa_%28Museo_del_Louvre%2C_1818-19%29.jpg/1200px-JEAN_LOUIS_TH%C3%89ODORE_G%C3%89RICAULT_-_La_Balsa_de_la_Medusa_%28Museo_del_Louvre%2C_1818-19%29.jpg,O,VIII,data/images_paintings/508.jpg
509,339 ,Géricault jean louis andré théodore, (17° J - J 824). ,officier de chasseurs à cheval de la garde impériale chargeant portrait équestre de m dieudonné officier des guides de l'empereur,,,,O,VIII,data/images_paintings/509.jpg
510,340 ,Géricault jean louis andré théodore, (17° J - J 824). ,officiers de chasseurs à cheval de la garde impériale esquisse,,,,,E F XIXe S 1er étage II,
511,342 ,Géricault jean louis andré théodore, (1791-18241. ,le cuirassier blessé esquisse,46.0,55.2,https://upload.wikimedia.org/wikipedia/commons/thumb/a/ab/Brooklyn_Museum_-_The_Wounded_Cuirassier_study_%28Le_Cuirassier_bless%C3%A9_quittant_le_feu_esquisse%29_-_Th%C3%A9odore_G%C3%A9ricault.jpg/1200px-Brooklyn_Museum_-_The_Wounded_Cuirassier_study_%28Le_Cuirassier_bless%C3%A9_quittant_le_feu_esquisse%29_-_Th%C3%A9odore_G%C3%A9ricault.jpg,,E F XIXe S 1er étage II,data/images_paintings/511.jpg
512,343 ,Géricault jean louis andré théodore, (1791-18241. ,un carabinier,85.0,101.0,https://upload.wikimedia.org/wikipedia/commons/thumb/0/0d/G%C3%A9ricault_-_Portrait_de_carabinier_-_Louvre.jpg/1200px-G%C3%A9ricault_-_Portrait_de_carabinier_-_Louvre.jpg,,E F XIXe S 1er étage III,data/images_paintings/512.jpg
513,344 ,Géricault jean louis andré théodore, (1791-18241. ,le four à plâtre,61.0,50.0,https://upload.wikimedia.org/wikipedia/commons/thumb/e/e6/Jean_Louis_Th%C3%A9odore_G%C3%A9ricault_007.jpg/1200px-Jean_Louis_Th%C3%A9odore_G%C3%A9ricault_007.jpg,,E F XIXe S 1er étage I,data/images_paintings/513.jpg
514,345 ,Géricault jean louis andré théodore, (1791-18241. ,cheval turc dans une écurie,25.0,35.0,https://s3.eu-west-3.amazonaws.com/pop-phototeque/joconde/000PE001276/89ee1592.jpg,,E F XIXe S 1er étage I,data/images_paintings/514.jpg
515,348 ,Géricault jean louis andré théodore, (1791-18241. ,course de chevaux à epsom en 1821,,,,O,VIII,
516,349 ,Géricault jean louis andré théodore, (1791-18241. ,la course,60.0,45.0,https://upload.wikimedia.org/wikipedia/commons/1/1d/Riderless_Horse_Races_1817_Theodore_Gericault.jpg,,E F XIXe S 1er étage I,data/images_paintings/516.jpg
517,350 ,Géricault jean louis andré théodore, (1791-18241. ,tête de chien bouledogue,,,,,E F XIXe S 1er étage I,
518,350 a ,Géricault jean louis andré théodore, (1791-18241. ,la course des barberi au corso à rome,,,,,E F XIXe S 1er étage II,
519,351 ,Géricault jean louis andré théodore, (1791-18241. ,chevaux de course,41.0,29.0,,,E F XIXe S 1er étage II,
520,352 ,Géricault jean louis andré théodore, (1791-18241. ,chevaux de course,41.0,29.0,,,E F XIXe S 1er étage II,
521,353 ,Géricault jean louis andré théodore, (1791-18241. ,cheval,54.5,65.5,https://upload.wikimedia.org/wikipedia/commons/f/fc/Gericault_tete.jpg,,E F XIXe S 1er étage I,data/images_paintings/521.jpg
522,354 ,Géricault jean louis andré théodore, (1791-18241. ,intérieur d'écurie,,,,,E F XIXe S 1er étage II,
523,355 b ,Géricault jean louis andré théodore, (1791-18241. ,portrait présumé du peintre par lui même,,,,,E F XIXe S 1er étage III,
524,356 ,Géricault jean louis andré théodore, (1791-1821) ,la justice et la vengeance divine poursuivant le crime d'après prud'hon,,,,,E F XIXe S 1er étage II,
525,S N ,Géricault jean louis andré théodore, (1791-1821) ,portrait du peintre a colin,,,,,E F XIXe S 1er étage I,
526,S N ,Géricault jean louis andré théodore, (1791-1821) ,première esquisse du radeau de la méduse,,,,,E F XIXe S 1er étage II,
527,S No ,Gérôme léon, (1824-1904). ,un combat de coqs,204.0,143.0,https://upload.wikimedia.org/wikipedia/commons/thumb/1/1e/Jean-L%C3%A9on_G%C3%A9r%C3%B4me_-_Young_Greeks_Attending_a_Cock_Fight_-_Google_Art_Project.jpg/1200px-Jean-L%C3%A9on_G%C3%A9r%C3%B4me_-_Young_Greeks_Attending_a_Cock_Fight_-_Google_Art_Project.jpg,,Marine,data/images_paintings/527.jpg
528, ,Gérôme léon, (1824-1904). ,voir clouet d'après 2944 gigoux jean françois 1809 1895 — portrait du général polonais dwernicki,,,,,E F XIXe S 1er étage II,
529,2945 ,Gérôme léon, (1824-1904). ,portrait de charles fourier,,,,,Marine,
530,361 ,Girodet de roucy trioson anne louis, (1707-1824). ,le sommeil d'endymion,261.0,198.0,https://upload.wikimedia.org/wikipedia/commons/thumb/d/d8/Anne-louis_girodet_de_roussy-trioson%2C_endimione%2C_effetto_di_luna%2C_1791%2C_01.jpg/1200px-Anne-louis_girodet_de_roussy-trioson%2C_endimione%2C_effetto_di_luna%2C_1791%2C_01.jpg,O,I,data/images_paintings/530.jpg
531,362 a ,Girodet de roucy trioson anne louis, (1767-1824). ,portrait du baron dominique jean larrey 1766842,,,,E,II,
532,S No ,Girodet de roucy trioson anne louis, (1767-1824). ,etude pour le sommeil d'endymion,,,,,Coll Schlichting,
533,363 ,Gleyre charles, (1807-1874). ,les illusions perdues ou le soir,,,,,E F XIXe S 1er étage I,
534,365 ,Gourmont jean de, (vivait en 1557). ,la nativité,,,,,XI,
535,366 ,Granet françois marius, (177^-1849). ,vue intérieure du colisée à rome,160.0,125.0,https://s3.eu-west-3.amazonaws.com/pop-phototeque/joconde/000PE001343/08-522317.jpg,,E F XIXe S 1er étage I,data/images_paintings/535.jpg
536,367 ,Granet françois marius, (177^-1849). ,le peintre sodoma porté à l'hôpital,100.0,75.0,https://s3.eu-west-3.amazonaws.com/pop-phototeque/joconde/000PE001344/01-017592.jpg,,Marine,data/images_paintings/536.jpg
537,367 a ,Granger jean pierre, (1779-1840). ,portrait de madame granger,,,,O,VIII,
538,368 ,Greuze jean baptiste," (172=,-180=,). ",l'empereur sévère reproche à caracalla son fils d'avoir voulu l'assassiner,,,,E,XV,
539,369 ,Greuze jean baptiste," (172=,-180=,). ",l'accordée de village,117.0,92.0,https://upload.wikimedia.org/wikipedia/commons/8/8b/Jean-Baptiste_Greuze_-_L%27Accord%C3%A9e_de_Village_-_WGA10655.jpg,E,XVI,data/images_paintings/539.jpg
540,370 ,Greuze jean baptiste," (172=,-180=,). ",la malédiction paternelle,162.0,130.0,https://upload.wikimedia.org/wikipedia/commons/0/08/La_malediction_paternelle.jpg,S,XVI,data/images_paintings/540.jpg
541,371 ,Greuze jean baptiste," (172=,-180=,). ",le fils puni '',,,https://upload.wikimedia.org/wikipedia/commons/2/2b/Jean-Baptiste_Greuze%2C_Study_for_Le_fils_puni%2C_Red_chalk_on_paper%2C_San_Antonio_Museum_of_Art.jpg,S,XVI,data/images_paintings/541.jpg
542,372 ,Greuze jean baptiste," (172=,-180=,). ",la cruche cassée,85.0,110.0,https://upload.wikimedia.org/wikipedia/commons/thumb/2/23/Jean-Baptiste_Greuze_001.jpg/1200px-Jean-Baptiste_Greuze_001.jpg,S,XVI,data/images_paintings/542.jpg
543,372 a ,Greuze jean baptiste," (172=,-180=,). ",la laitière,86.0,106.0,https://upload.wikimedia.org/wikipedia/commons/thumb/3/35/J-B_Greuze_la_laiti%C3%A8re_07244.jpg/1200px-J-B_Greuze_la_laiti%C3%A8re_07244.jpg,N,XVI,data/images_paintings/543.jpg
544,372 c ,Greuze jean baptiste," (172=,-180=,). ",l'oiseau mort,55.0,68.0,https://upload.wikimedia.org/wikipedia/commons/9/9f/Jean-Baptiste_Greuze_-_The_Dead_Bird_-_WGA10679.jpg,N,XVI,data/images_paintings/544.jpg
545,372 d ,Greuze jean baptiste," (172=,-180=,). ",l'enfant à la poupée,,,,S,XVI,
546,372 e ,Greuze jean baptiste," (172=,-180=,). ",l'effroi,,,https://upload.wikimedia.org/wikipedia/commons/e/e5/Jean-Baptiste_Greuze_-_Fear%2C_Expression_Head_-_WGA10675.jpg,S,XVI,data/images_paintings/546.jpg
547,373 ,Greuze jean baptiste," (172=,-180=,). ",portrait du peintre etienne jeaurat,,,,E,XVI,
548,373 a ,Greuze jean baptiste," (172=,-180=,). ",portrait d'homme ,54.8,64.7,,E,XVI,
549,373 b ,Greuze jean baptiste," (172=,-180=,). ",portrait du médecin duval,,,,,IVe S Meubles XVIIIe,
550,374 ,Greuze jean baptiste, (1725-1805). ,tête de jeune fille étude,,,,N,XVI,
551,375 ,Greuze jean baptiste, (1725-1805). ,tête de jeune fille étude,,,,N,XVI,
552,376 ,Greuze jean baptiste, (1725-1805). ,tête de jeune fine,,,,E,I,
553,377 ,Greuze jean baptiste, (1725-1805). ,danaë 1 0 ■ 379,,,,E,Musée Charles X S III,
554,381 ,Greuze jean baptiste, (1725-1805). ,son portrait par lui même,,,,E,XVI,
555,S N ,Greuze jean baptiste, (1725-1805). ,l'innocence enchaînée par les amours et suivie du repentir ,,,,,Coll Schlichting,
556,384 ,Grimou alexis, ( 1678-1733). ,son portrait par lui même,,,,S,XVI,
557,385 ,Grimou alexis, ( 1678-1733). ,un buveur,85.0,100.0,https://s3.eu-west-3.amazonaws.com/pop-phototeque/joconde/000PE001368/62698.jpg,S,XVI,data/images_paintings/557.jpg
558,388 ,Gros antoine jean, (1771-1835). ,le général en chef bonaparte visite les pestiférés de jaffa 111 0 389,,,,E,Musée Charles X S III,
559,390 ,Gros antoine jean, (1771-1835). ,— françois ier et charles quint visitant les tomt beaux de l'église de saint denis,,,,,S des dessins XIXe,
560,391 ,Gros antoine jean, (1771-1835). ,bonaparte à arcole,,,,E,III,
561,391 a ,Gros antoine jean, (1771-1835). ,portrait de christine boyer première femme du prince lucien bonaparte,,,,S,III,
562,392 ,Gros antoine jean, (1771-1835). ,portrait du comte alcide de la rivallière élève,,,,E,Musée Charles X S III,
563, ,Gros antoine jean, (1771-1835). ,plafond le génie de la france anime les arts protège l'humanité — voussures enfants tenant l'écu royal ou des guirlandes et couronnes de laurier,,,,,Musée Charles X S I,
564, ,Gros antoine jean, (1771-1835). ,plafond  la véritable gloire s'appuie sur la vertu mars écoutant la modération le temps élève la vérité six compartiments bustes de périclès auguste léon x françois 1er louis xiv charles x —,,,,,V,
565,S o ,S  gudin théodore, (1802-1879). ,marine naufrage 389,,,,,Musée Charles X S III,
566,393 ,Guérin pierre narcisse, (1774-1833). ,le  retour de marcus sextus,243.0,217.0,https://upload.wikimedia.org/wikipedia/commons/thumb/b/b8/The_Return_of_Marcus_Sextus_1799_Pierre-Narcisse_Gu%C3%A9rin.jpg/1200px-The_Return_of_Marcus_Sextus_1799_Pierre-Narcisse_Gu%C3%A9rin.jpg,N,Musée Charles X S III,data/images_paintings/566.jpg
567,395 ,Guérin pierre narcisse, (1774-1833). ,phèdre et hippolyte,46.0,33.0,https://upload.wikimedia.org/wikipedia/commons/b/b6/Ph%C3%A8dre_et_Hippolyte_par_Pierre-Narcisse_Gu%C3%A9rin%2C_1802_-_Mus%C3%A9e_du_Louvre.jpg,E,II,data/images_paintings/567.jpg
568,396 ,Guérin pierre narcisse, (1774-1833). ,andromaque et pyrrhus,457.0,342.0,https://upload.wikimedia.org/wikipedia/commons/thumb/4/4e/Gu%C3%A9rin_Andromaque_et_Pyrrhus.JPG/1200px-Gu%C3%A9rin_Andromaque_et_Pyrrhus.JPG,N,II,data/images_paintings/568.jpg
569,397 ,Guérin pierre narcisse, (1774-1833). ,enée racontant à didon les malheurs de la ville de troie,390.0,292.0,https://upload.wikimedia.org/wikipedia/commons/8/82/Pierre-Narcisse_Gu%C3%A9rin_-_Dido_and_Aeneas_-_WGA10972.jpg,N,II,data/images_paintings/569.jpg
570,397 a ,Guérin pierre narcisse, (1774-1833). ,enée et didon première pensée du tableau précédent,,,,O,I,
571,398 ,Guérin pierre narcisse, (1774-1833). ,clytemnestre conseillée par egisthe s'apprête à frapper agamemlion,,,,E,III,
572,399 ,Guérin pierre narcisse, (1774-1833). ,l'aurore et céphale,186.0,254.5,https://upload.wikimedia.org/wikipedia/commons/f/fc/Gu%C3%A9rin-amouretomphale.jpg,N,III,data/images_paintings/572.jpg
573, ,Guérin pierre narcisse, (1774-1833). ,deux génies de l'immortalité médaillon du plafond,,,,,S des Antonins,
574, ,Guiard mme, (1749-1803). ,portrait de pajou sculpteur pastel,,,,,S des Pastels,
575,S No ,Guiard mme, (1749-1803). ,portrait de mme victoire pastel,,,,,S des Pastels,
576,400 a ,Guiard mme, (1749-1803). ,portrait du peintre vincent,,,,O,I,
577, ,Guichard joseph benoit, (1806-1880). ,le triomphe de la terre d'après le brun voûte,,,,,Galerie d'Apollon,
578,S N ,Guigou paul camille, (1834-1871). ,route de la gineste près de marseille,,,,,E F XIXe S 2e étage II,
579,S N ,Guigou paul camille, (1834-1871). ,la lavandière,,,,,E F XIXe S 2e étage II,
580,402 ,Halle noël, ( 1711-1781). ,l'automne,,,,S,XVI,
581,403 ,Halle noël, ( 1711-1781). ,les génies de la poésie de l'histoire de la physique et de l'astronomie,,,,S,XVI,
582,404 ,Halle noël, ( 1711-1781). ,libéralité de cimon l'athénien,322.0,322.0,https://s3.eu-west-3.amazonaws.com/pop-phototeque/joconde/000PE001422/94de15021.jpg,S,XVI,data/images_paintings/582.jpg
583,405 ,Halle noël, ( 1711-1781). ,dispute de minerve et de neptune,197.5,156.5,https://s3.eu-west-3.amazonaws.com/pop-phototeque/joconde/000PE001421/90ee2151.jpg,,V,data/images_paintings/583.jpg
584,406 ,Hamon jean louis, (1821-1874). ,la comédie humaine,,,,,S des dessins XIXe,
585,S N ,Hébert ernest, (1817-1908). ,le baiser de judas,186.0,255.0,,,Marine,
586,S Nu ,Hébert ernest, (1817-1908). ,les cervarolles,176.0,288.0,https://upload.wikimedia.org/wikipedia/commons/thumb/5/55/Ernest_h%C3%A9bert%2C_le_cervarole_%28le_donne_di_Cervara_di_Roma%2C_stati_romani%29%2C_1859_circa.JPG/1200px-Ernest_h%C3%A9bert%2C_le_cervarole_%28le_donne_di_Cervara_di_Roma%2C_stati_romani%29%2C_1859_circa.JPG,N,VIII,data/images_paintings/586.jpg
587,S No ,Hébert ernest, (1817-1908). ,la malaria campagne romaine,,,,,E F XIXe S 1er étage III,
588,S N ,Hébert ernest, (1817-1908). ,portrait de mme m'ey isabey,,,,,S Isabey,
589,408 ,Heim françois joseph, (1787-1865). ,sujet tiré de l'«histoire des juifs» par josèphe,,,,E,VIII,data/images_paintings/589.jpg
590, ,Hennequin philippe auguste, (1763-1833). ,l'hercule français plafond,,,,,S des Antonins,
591,64,Henner jean jacques, (1829-1905). ,la liseuse,123.0,94.0,https://upload.wikimedia.org/wikipedia/commons/5/5f/Jean_Jacques_Henner_-_La_liseuse.jpg,,Musée Charles X S III,data/images_paintings/591.jpg
592,410 ,Hilair jean baptiste, (travaillait entre 1781 et 1822) ,la lecture,118.0,136.0,https://s3.eu-west-3.amazonaws.com/pop-phototeque/joconde/000PE001473/98de12133.jpg,N,XVI,data/images_paintings/592.jpg
593,410 c ,Hue jean françois, (1751-1823). ,marine effet de clair de tune,,,,,Marine,
594,410 h ,Hue jean françois, (1751-1823). ,vue de la ville de la rade et du port de st malo prise de st servan ,,,,,Marine,
595,411 ,Huet jean baptiste, (1745-1811). ,un dogue se jetant sur des oies sauvages et leurs petits,,,,,IVe S Meubles XVIIIe,
596,412 ,Huet paul, (1803-1869).—L'inondation ,de saint cloud,300.0,203.5,https://upload.wikimedia.org/wikipedia/commons/thumb/5/59/Paul_Huet_-_L%27inondation_de_Saint-Cloud.JPG/1200px-Paul_Huet_-_L%27inondation_de_Saint-Cloud.JPG,N,VIII,data/images_paintings/596.jpg
597,412 a ,Huet paul, (1803-1869).—L'inondation ,coucher de soleil à seine port,,,,,E F XIXe S 2e étage I,
598,413 ,Huet paul, (1803-1869).—L'inondation ,calme du matin intérieur de forêt,86.0,58.0,https://s3.eu-west-3.amazonaws.com/pop-phototeque/joconde/000PE001498/91ee1911.jpg,,E F XIXe S 2e étage I,data/images_paintings/598.jpg
599,414 ,Huet paul, (1803-1869).—L'inondation ,fraîcheur des bois fourré de la forêt,102.0,67.0,https://s3.eu-west-3.amazonaws.com/pop-phototeque/joconde/000PE001497/93de1583.jpg,,E F XIXe S 2e étage I,data/images_paintings/599.jpg
600,2946 ,Huet paul, (1803-1869).—L'inondation ,les chasseurs forêt de fontainebleau,125.0,87.0,https://s3.eu-west-3.amazonaws.com/pop-phototeque/joconde/000PE001500/98de3250.jpg,,E F XIXe S 1er étage III,data/images_paintings/600.jpg
601,2947 ,Huet paul, (1803-1869).—L'inondation ,grande marée d'équinoxe aux environs de honfleur,164.5,101.0,https://s3.eu-west-3.amazonaws.com/pop-phototeque/joconde/000PE001490/98de3244.jpg,,E F XIXe S 2e étage I,data/images_paintings/601.jpg
602,2948 ,Huet paul, (1803-1869).—L'inondation ,le parc de saint cloud un jour de fête,46.0,36.0,https://s3.eu-west-3.amazonaws.com/pop-phototeque/joconde/000PE001493/80ee1132.jpg,,E F XIXe S 2e étage II,data/images_paintings/602.jpg
603,2949 ,Huet paul, (1803-1869). ,la ferme,27.0,21.8,https://s3.eu-west-3.amazonaws.com/pop-phototeque/joconde/000PE001496/93de1581.jpg,,E F XIXe S 2e étage II,data/images_paintings/603.jpg
604,2950 ,Huet paul, (1803-1869). ,chaumière normande vieux trouvillei,,,,,E F XIXe S 2e étage II,
605,2951 ,Huet paul, (1803-1869). ,cheval normand,27.0,21.0,https://s3.eu-west-3.amazonaws.com/pop-phototeque/joconde/000PE001494/93de1579.jpg,,E F XIXe S 2e étage II,data/images_paintings/605.jpg
606,2952 a ,Huet paul, (1803-1869). ,brisants à la pointe de granville,103.0,68.0,https://s3.eu-west-3.amazonaws.com/pop-phototeque/joconde/000PE001501/98de3242.jpg,,E F XIXe S 2e étage II,data/images_paintings/606.jpg
607,S N ,Huet paul, (1803-1869). ,l'inondation de saint cloud carton,,,,,Esc T T,
608,415 ,Ingres jean auguste dominique, (1780-1*671. ,jésus christ donne à saint pierre les clés du paradis,,,,S,VIII,
609,416 ,Ingres jean auguste dominique, (1780-1*671. ,la vierge à l'hostie,,,https://upload.wikimedia.org/wikipedia/commons/8/84/Ingres_the_virgin_of_the_host.jpg,,E F XIXe S 1er étage I,data/images_paintings/609.jpg
610,419 ,Ingres jean auguste dominique, (1780-1867). ,roger délivrant angélique,190.0,147.0,https://upload.wikimedia.org/wikipedia/commons/thumb/8/84/Jean_Auguste_Dominique_Ingres_-_Roger_Delivering_Angelica.jpg/1200px-Jean_Auguste_Dominique_Ingres_-_Roger_Delivering_Angelica.jpg,E,VIII,data/images_paintings/610.jpg
611,420 ,Ingres jean auguste dominique, (1780-1867). ,jeanne d'arc assistant au sacre de charles vii dans la cathédrale de reims,,,,S,VIII,
612,421 ,Ingres jean auguste dominique, (1780-1867). ,cedipe expliquant l'énigme,,,,,V,data/images_paintings/612.jpg
613,422 ,Ingres jean auguste dominique, (1780-1867). ,la source,,,https://upload.wikimedia.org/wikipedia/commons/thumb/4/46/Jean_Auguste_Dominique_Ingres_-_The_Spring_-_Google_Art_Project_2.jpg/1200px-Jean_Auguste_Dominique_Ingres_-_The_Spring_-_Google_Art_Project_2.jpg,,V,data/images_paintings/613.jpg
614,422 b ,Ingres jean auguste dominique, (1780-1867). ,odalisque couchée,,,,S,VIII,
615,423 ,Ingres jean auguste dominique, (1780-1867). ,la baigneuse,27.0,35.0,https://upload.wikimedia.org/wikipedia/commons/thumb/9/9d/La_petite_baigneuse_-_Ingres_%28Louvre%2C_RF_1728%29.jpg/1200px-La_petite_baigneuse_-_Ingres_%28Louvre%2C_RF_1728%29.jpg,E,VIII,data/images_paintings/615.jpg
616,424 ,Ingres jean auguste dominique, (1780-1867). ,la chapelle sixtine,,,,,E F XIXe S 1er étage III,
617,425 ,Ingres jean auguste dominique, (1780-1867). ,portrait de m cordier,,,,S,VIII,
618,426 ,Ingres jean auguste dominique, (1780-1867). ,portrait de m philibert rivière maître des requêtes ,,,,O,VIII,
619,427 ,Ingres jean auguste dominique, (1780-1867). ,portrait de mme rivière marie françoise beauregard femme de m philibert rivière,,,,O,VIII,
620,428 ,Ingres jean auguste dominique, (1780-1867). ,portrait de melle rivière morte à l'âge de 15 ans,,,,S,VIII,
621,428 a ,Ingres jean auguste dominique, (1780-1867). ,portrait de m bochet ami du peintre,,,,S,VIII,
622,428 b ,Ingres jean auguste dominique, (1780-1867). ,portrait de m bertin aîné,,,,E,VIII,
623,428 c ,Ingres jean auguste dominique, (1780-1867). ,vénus anadyomènc réduction peinte attribué,,,,,E F XIXe S 1er étage II,
624,428 d ,Ingres jean auguste dominique, (1780-1867). ,la source réduction peinte attribué,,,,,E F XIXe S 1er étage II,
625,S o ,Ingres jean auguste dominique, (1780-1867). ,la petite baigneuse intérieur de harem,27.0,35.0,https://upload.wikimedia.org/wikipedia/commons/thumb/9/9d/La_petite_baigneuse_-_Ingres_%28Louvre%2C_RF_1728%29.jpg/1200px-La_petite_baigneuse_-_Ingres_%28Louvre%2C_RF_1728%29.jpg,,E F XIXe S 1er étage II,data/images_paintings/625.jpg
